{
  "schemaVersion": 2,
  "datasetVersion": "model-y-2026-refresh-parent-evidence-v2-reviewed-final",
  "knowledgeScopeId": "model-y-2026-cn-2026-refresh-rwd",
  "cases": [
    {
      "caseId": "basic-vehicle-warranty",
      "query": "车辆基本有限质量保证是什么？",
      "category": "WARRANTY",
      "answerability": "ANSWERABLE",
      "answerCriteria": [
        "说明车辆基本有限质量保证的覆盖范围、期限和主要限制"
      ],
      "acceptableEvidenceSets": [
        {
          "requiredParentIds": [
            "b8c0c230c512ac2498efd54bae90ed224c6fb2544582aa90784041eaae8532bd"
          ],
          "optionalLocatorChildIds": [],
          "rationale": "车辆基本有限质量保证小节完整说明适用范围和期限"
        }
      ],
      "tags": [
        "PDF",
        "直接问题"
      ],
      "split": "DEV"
    },
    {
      "caseId": "seatbelt-and-airbag-warranty",
      "query": "座椅安全带和气囊系统有限质量保证是什么？",
      "category": "WARRANTY",
      "answerability": "ANSWERABLE",
      "answerCriteria": [
        "说明座椅安全带和气囊系统有限质量保证的覆盖范围和期限"
      ],
      "acceptableEvidenceSets": [
        {
          "requiredParentIds": [
            "f1f1aa2d7c1a28ec63dbef22810033750bed3850d711036504865121dfb2210a"
          ],
          "optionalLocatorChildIds": [],
          "rationale": "该 Parent 对应座椅安全带和气囊系统保证小节"
        }
      ],
      "tags": [
        "PDF"
      ],
      "split": "DEV"
    },
    {
      "caseId": "front-passenger-airbag-for-child",
      "query": "儿童坐在副驾驶座椅时，前排乘客安全气囊应该处于什么状态？",
      "category": "SAFETY",
      "answerability": "ANSWERABLE",
      "answerCriteria": [
        "给出前排乘客安全气囊状态",
        "说明儿童乘坐时的安全条件"
      ],
      "acceptableEvidenceSets": [
        {
          "requiredParentIds": [
            "0186c30613a694599222d4506940b1c78e18c2e065661dabe976be5b87ecd2cd"
          ],
          "optionalLocatorChildIds": [],
          "rationale": "前排乘客安全气囊小节直接说明儿童乘坐时的状态"
        }
      ],
      "tags": [
        "PDF",
        "安全"
      ],
      "split": "TEST"
    },
    {
      "caseId": "diy-remove-wheel-nut-cap",
      "query": "Model Y 的轮毂螺母罩如何拆卸和安装？",
      "category": "DIY_OPERATION",
      "answerability": "ANSWERABLE",
      "answerCriteria": [
        "说明拆卸工具和操作步骤",
        "说明重新安装方法"
      ],
      "acceptableEvidenceSets": [
        {
          "requiredParentIds": [
            "9c096d4086260905714f0ba095e37eea3a14b7e8c16488bcbb623838a79a0954"
          ],
          "optionalLocatorChildIds": [],
          "rationale": "轮毂螺母罩小节完整包含拆卸和安装步骤"
        }
      ],
      "tags": [
        "PDF",
        "DIY"
      ],
      "split": "TEST"
    },
    {
      "caseId": "diy-cabin-air-filter-cn-interval",
      "query": "中国大陆 Model Y 空调滤清器建议多久更换一次？",
      "category": "DIY_OPERATION",
      "answerability": "ANSWERABLE",
      "answerCriteria": [
        "只给出中国大陆空调滤清器建议更换时间或周期"
      ],
      "acceptableEvidenceSets": [
        {
          "requiredParentIds": [
            "40607d84979a97c3c36aa9614d8729ecb0f51581535211446519984002ee31bf"
          ],
          "optionalLocatorChildIds": [],
          "rationale": "空调滤清器小节直接给出中国大陆更换时间"
        }
      ],
      "tags": [
        "PDF",
        "DIY",
        "地区条件"
      ],
      "split": "TEST"
    },
    {
      "caseId": "diy-tire-pressure-location",
      "query": "Model Y 在哪里查看胎压和推荐冷胎压力？",
      "category": "VEHICLE_OPERATION",
      "answerability": "ANSWERABLE",
      "answerCriteria": [
        "说明查看胎压的车辆菜单位置",
        "说明推荐冷胎压力来源"
      ],
      "acceptableEvidenceSets": [
        {
          "requiredParentIds": [
            "5ab917f72db32aac6172c8a7dcbafbcb381ae373a57e6cb6d9063fc17b5d9250"
          ],
          "optionalLocatorChildIds": [],
          "rationale": "胎压小节同时说明显示位置和推荐压力"
        }
      ],
      "tags": [
        "PDF"
      ],
      "split": "TEST"
    },
    {
      "caseId": "diy-roof-rack-installation",
      "query": "安装 Model Y 车顶行李架前有什么要求和步骤？",
      "category": "DIY_OPERATION",
      "answerability": "ANSWERABLE",
      "answerCriteria": [
        "说明适用的车顶行李架",
        "说明安装位置和关键限制"
      ],
      "acceptableEvidenceSets": [
        {
          "requiredParentIds": [
            "e6012018a0a23970d2f3e70b8df7144902aab40cc99c231142be0fb6ac07a919"
          ],
          "optionalLocatorChildIds": [],
          "rationale": "车顶行李架安装小节包含适配要求和安装步骤"
        }
      ],
      "tags": [
        "PDF",
        "DIY"
      ],
      "split": "TEST"
    },
    {
      "caseId": "diy-door-handle-ice",
      "query": "冬天车门把手结冰时应如何处理？",
      "category": "DIY_OPERATION",
      "answerability": "ANSWERABLE",
      "answerCriteria": [
        "给出车门把手除冰步骤",
        "说明禁止的处理方式"
      ],
      "acceptableEvidenceSets": [
        {
          "requiredParentIds": [
            "463b3207184a9670f13ea6efe91420b0f535b21ed9b4f3bf990ab89442b91f2b"
          ],
          "optionalLocatorChildIds": [],
          "rationale": "车门把手除冰小节包含 WD-40 和操作限制"
        }
      ],
      "tags": [
        "PDF",
        "DIY",
        "警告"
      ],
      "split": "TEST"
    },
    {
      "caseId": "diy-phone-app-unlock-start",
      "query": "如何使用手机应用程序解锁并启动车辆？",
      "category": "VEHICLE_OPERATION",
      "answerability": "ANSWERABLE",
      "answerCriteria": [
        "说明手机应用解锁操作",
        "说明手机应用启动车辆操作"
      ],
      "acceptableEvidenceSets": [
        {
          "requiredParentIds": [
            "c2474b851114e3e92a07f5311c18fd068e11d37aca00917d1f04dc6ebb9e33b4"
          ],
          "optionalLocatorChildIds": [],
          "rationale": "手机应用控制车辆小节涵盖解锁和启动"
        }
      ],
      "tags": [
        "PDF",
        "手机应用"
      ],
      "split": "TEST"
    },
    {
      "caseId": "diy-hepa-filter",
      "query": "如何更换 Model Y 的 HEPA 空调滤清器？",
      "category": "DIY_OPERATION",
      "answerability": "ANSWERABLE",
      "answerCriteria": [
        "说明 HEPA 滤清器更换步骤",
        "说明中国大陆周期或适用条件"
      ],
      "acceptableEvidenceSets": [
        {
          "requiredParentIds": [
            "2a1086def50be2e05cbd1ffdf385a794a618229ddef4792f611f978028282c43"
          ],
          "optionalLocatorChildIds": [],
          "rationale": "HEPA 空调滤清器小节包含更换步骤"
        }
      ],
      "tags": [
        "PDF",
        "DIY"
      ],
      "split": "TEST"
    },
    {
      "caseId": "diy-front-headrest",
      "query": "前排座椅头枕如何拆卸和重新安装？",
      "category": "DIY_OPERATION",
      "answerability": "ANSWERABLE",
      "answerCriteria": [
        "说明头枕拆卸步骤",
        "说明重新安装要求"
      ],
      "acceptableEvidenceSets": [
        {
          "requiredParentIds": [
            "7074fde625e43c6f025efbc6db12a7d4229cd80f03c3831acf7af5cd9d1b1fb9"
          ],
          "optionalLocatorChildIds": [],
          "rationale": "前排头枕小节包含拆卸和安装说明"
        }
      ],
      "tags": [
        "PDF",
        "DIY"
      ],
      "split": "TEST"
    },
    {
      "caseId": "service-center-beijing-liuliqiao",
      "query": "北京六里桥特斯拉中心的地址和服务中心电话是什么？",
      "category": "SERVICE_CENTER",
      "answerability": "ANSWERABLE",
      "answerCriteria": [
        "给出北京六里桥中心地址",
        "给出服务中心电话"
      ],
      "acceptableEvidenceSets": [
        {
          "requiredParentIds": [
            "656953a9bf1a3b4dd60a836f660c29abbe831ab4766bd6881d5297f0faf5ab84"
          ],
          "optionalLocatorChildIds": [],
          "rationale": "服务中心记录同时包含六里桥地址和电话"
        }
      ],
      "tags": [
        "HTML",
        "服务中心"
      ],
      "split": "TEST"
    },
    {
      "caseId": "service-center-shanghai-jinqiao",
      "query": "上海金桥特斯拉中心的地址和服务中心电话是什么？",
      "category": "SERVICE_CENTER",
      "answerability": "ANSWERABLE",
      "answerCriteria": [
        "给出上海金桥中心地址",
        "给出服务中心电话"
      ],
      "acceptableEvidenceSets": [
        {
          "requiredParentIds": [
            "7d4dc35c3583ef80c3a3e72e3806fabd6af521038f65ea043907cb43791d6148"
          ],
          "optionalLocatorChildIds": [],
          "rationale": "服务中心记录同时包含金桥地址和电话"
        }
      ],
      "tags": [
        "HTML",
        "服务中心"
      ],
      "split": "TEST"
    },
    {
      "caseId": "software-update",
      "query": "Model Y 如何检查并排除蓝牙故障？",
      "category": "VEHICLE_OPERATION",
      "answerability": "ANSWERABLE",
      "answerCriteria": [
        "说明检查更新、下载或安装更新的步骤和前提"
      ],
      "acceptableEvidenceSets": [
        {
          "requiredParentIds": [
            "273c3c4db4db6b9405cb6233334c2150441872e714eae1829129bba2ba24cd55"
          ],
          "optionalLocatorChildIds": [],
          "rationale": "审核备注将该问题改为蓝牙故障排查，使用对应蓝牙 Parent"
        }
      ],
      "tags": [
        "PDF",
        "软件",
        "新增"
      ],
      "split": "TEST"
    },
    {
      "caseId": "driver-profile",
      "query": "如何授予另一位驾驶员访问权限？",
      "category": "VEHICLE_OPERATION",
      "answerability": "ANSWERABLE",
      "answerCriteria": [
        "说明创建、选择或切换驾驶员访问权限的方法"
      ],
      "acceptableEvidenceSets": [
        {
          "requiredParentIds": [
            "08117c218014f6fb5ddbf4329a90e4ffec7b3781ff885b6b1400663395a38f47"
          ],
          "optionalLocatorChildIds": [],
          "rationale": "手机应用小节"
        }
      ],
      "tags": [
        "PDF",
        "个性化",
        "新增"
      ],
      "split": "DEV"
    },
    {
      "caseId": "phone-key-setup",
      "query": "如何将手机设置为 Model Y 的钥匙？",
      "category": "VEHICLE_OPERATION",
      "answerability": "ANSWERABLE",
      "answerCriteria": [
        "说明手机钥匙的配对或启用步骤"
      ],
      "acceptableEvidenceSets": [
        {
          "requiredParentIds": [
            "122ae884d2f43bb1aa19a897d2da814b3fa22783cdea5ef3438073957f89e178"
          ],
          "optionalLocatorChildIds": [],
          "rationale": "手机钥匙小节"
        }
      ],
      "tags": [
        "PDF",
        "钥匙",
        "新增"
      ],
      "split": "TEST"
    },
    {
      "caseId": "chengdu-service-center",
      "query": "成都锦江特斯拉中心的地址是什么？",
      "category": "SERVICE_CENTER",
      "answerability": "ANSWERABLE",
      "answerCriteria": [
        "给出该服务中心的完整地址"
      ],
      "acceptableEvidenceSets": [
        {
          "requiredParentIds": [